[
  {
    "key": "allowance.family.daily_minutes",
    "scope": "person",
    "selector": "number",
    "default": 0,
    "label": "Daily Family minutes",
    "help": "How many minutes of Family packages this person may use per day. 0 means no limit.",
    "level": "basic",
    "secret": false,
    "lives_in": "person.allowance",
    "honoured_by": [
      "home"
    ]
  },
  {
    "key": "allowance.fun.daily_minutes",
    "scope": "person",
    "selector": "number",
    "default": 0,
    "label": "Daily Fun minutes",
    "help": "How many minutes of Fun packages this person may use per day. 0 means no limit.",
    "level": "basic",
    "secret": false,
    "lives_in": "person.allowance",
    "honoured_by": [
      "home"
    ]
  },
  {
    "key": "allowance.health.daily_minutes",
    "scope": "person",
    "selector": "number",
    "default": 0,
    "label": "Daily Health minutes",
    "help": "How many minutes of Health packages this person may use per day. 0 means no limit.",
    "level": "basic",
    "secret": false,
    "lives_in": "person.allowance",
    "honoured_by": [
      "home"
    ]
  },
  {
    "key": "allowance.home.daily_minutes",
    "scope": "person",
    "selector": "number",
    "default": 0,
    "label": "Daily Home minutes",
    "help": "How many minutes of Home packages this person may use per day. 0 means no limit.",
    "level": "basic",
    "secret": false,
    "lives_in": "person.allowance",
    "honoured_by": [
      "home"
    ]
  },
  {
    "key": "allowance.info.daily_minutes",
    "scope": "person",
    "selector": "number",
    "default": 0,
    "label": "Daily Info minutes",
    "help": "How many minutes of Info packages this person may use per day. 0 means no limit.",
    "level": "basic",
    "secret": false,
    "lives_in": "person.allowance",
    "honoured_by": [
      "home"
    ]
  },
  {
    "key": "allowance.learning.daily_minutes",
    "scope": "person",
    "selector": "number",
    "default": 0,
    "label": "Daily Learning minutes",
    "help": "How many minutes of Learning packages this person may use per day. 0 means no limit.",
    "level": "basic",
    "secret": false,
    "lives_in": "person.allowance",
    "honoured_by": [
      "home"
    ]
  },
  {
    "key": "allowance.media.daily_minutes",
    "scope": "person",
    "selector": "number",
    "default": 0,
    "label": "Daily Media minutes",
    "help": "How many minutes of Media packages this person may use per day. 0 means no limit.",
    "level": "basic",
    "secret": false,
    "lives_in": "person.allowance",
    "honoured_by": [
      "home"
    ]
  },
  {
    "key": "allowance.robot_body.daily_minutes",
    "scope": "person",
    "selector": "number",
    "default": 0,
    "label": "Daily Robot body minutes",
    "help": "How many minutes of Robot body packages this person may use per day. 0 means no limit.",
    "level": "basic",
    "secret": false,
    "lives_in": "person.allowance",
    "honoured_by": [
      "home"
    ]
  },
  {
    "key": "allowance.utilities.daily_minutes",
    "scope": "person",
    "selector": "number",
    "default": 0,
    "label": "Daily Utilities minutes",
    "help": "How many minutes of Utilities packages this person may use per day. 0 means no limit.",
    "level": "basic",
    "secret": false,
    "lives_in": "person.allowance",
    "honoured_by": [
      "home"
    ]
  },
  {
    "key": "backup.max_total_gb",
    "scope": "household",
    "selector": "number",
    "range": {
      "min": 0,
      "max": 1000
    },
    "default": 0,
    "label": "Backup storage limit (GB)",
    "help": "Once total backup storage passes this, the oldest backups are deleted first - checked after the normal seven-daily/four-weekly/three-monthly schedule. 0 means no extra limit.",
    "level": "advanced",
    "secret": false,
    "lives_in": "household.system",
    "honoured_by": [
      "home"
    ]
  },
  {
    "key": "chat.context_size_override",
    "scope": "household",
    "selector": "number",
    "range": {
      "min": 0,
      "max": 131072
    },
    "default": 0,
    "label": "Chat context size override",
    "help": "0 lets the hub pick the largest context that fits this computer's memory. A higher number can run out of memory; a lower one leaves headroom but remembers less of the conversation.",
    "level": "advanced",
    "secret": false,
    "lives_in": "household.ai",
    "honoured_by": [
      "home"
    ]
  },
  {
    "key": "chat.flash_attention_override",
    "scope": "household",
    "selector": "select",
    "range": {
      "options": [
        "auto",
        "on",
        "off"
      ]
    },
    "default": "auto",
    "label": "Flash attention override",
    "help": "\"Auto\" lets the hub decide based on the model and the quantized-KV-cache setting. Flash attention speeds up longer conversations; a very old GPU may not support it.",
    "level": "advanced",
    "secret": false,
    "lives_in": "household.ai",
    "honoured_by": [
      "home"
    ]
  },
  {
    "key": "chat.kv_cache_override",
    "scope": "household",
    "selector": "select",
    "range": {
      "options": [
        "auto",
        "quantized",
        "full"
      ]
    },
    "default": "auto",
    "label": "KV cache precision override",
    "help": "\"Auto\" quantizes the conversation cache to fit more context in the same memory, with a small quality tradeoff. \"Full\" uses full precision: more accurate, uses roughly twice the memory for the same context size.",
    "level": "advanced",
    "secret": false,
    "lives_in": "household.ai",
    "honoured_by": [
      "home"
    ]
  },
  {
    "key": "chat.model_id",
    "scope": "household",
    "selector": "text",
    "default": "",
    "label": "Selected chat model",
    "help": "The catalog model id currently downloaded and running for chat. Changed through the AI models page, not here.",
    "level": "expert",
    "secret": false,
    "lives_in": "household.ai",
    "honoured_by": [
      "home"
    ]
  },
  {
    "key": "home.access_token",
    "scope": "household",
    "selector": "text",
    "default": "",
    "label": "Home Assistant access token",
    "help": "A long-lived access token from your Home Assistant profile page, used to control your smart-home devices.",
    "level": "advanced",
    "secret": true,
    "lives_in": "household.integrations",
    "honoured_by": [
      "home"
    ]
  },
  {
    "key": "home.base_url",
    "scope": "household",
    "selector": "text",
    "default": "",
    "label": "Home Assistant URL",
    "help": "The address of your Home Assistant instance, e.g. http://homeassistant.local:8123.",
    "level": "advanced",
    "secret": false,
    "lives_in": "household.integrations",
    "honoured_by": [
      "home"
    ]
  },
  {
    "key": "household.conversation_retention_days",
    "scope": "household",
    "selector": "number",
    "range": {
      "min": 7,
      "max": 365
    },
    "default": 90,
    "label": "Conversation history retention",
    "help": "How long chat history is kept before it's deleted. A safety-flagged conversation involving a teen or child is always kept for at least 90 days regardless of this setting.",
    "level": "advanced",
    "secret": false,
    "lives_in": "household.system",
    "honoured_by": [
      "home"
    ]
  },
  {
    "key": "household.family_name",
    "scope": "household",
    "selector": "text",
    "default": "",
    "label": "Family name",
    "help": "Shown above your greeting on Home, e.g. \"Willow\" becomes \"Willow Family.\"",
    "level": "basic",
    "secret": false,
    "lives_in": "household.system",
    "honoured_by": [
      "home"
    ]
  },
  {
    "key": "household.home_place",
    "scope": "household",
    "selector": "text",
    "default": "",
    "label": "Household location",
    "help": "The place MaiPai uses for weather and other location-based answers, e.g. \"Seattle, WA\".",
    "level": "basic",
    "secret": false,
    "lives_in": "household.system",
    "honoured_by": [
      "home",
      "bot"
    ]
  },
  {
    "key": "household.locale",
    "scope": "household",
    "selector": "select",
    "range": {
      "options": [
        "en-US",
        "en-GB"
      ]
    },
    "default": "en-US",
    "label": "Language and region",
    "help": "Sets the household's date, time, and unit formatting.",
    "level": "basic",
    "secret": false,
    "lives_in": "household.system",
    "honoured_by": [
      "home",
      "bot"
    ]
  },
  {
    "key": "notifications.approvals.requested.telegram",
    "scope": "person",
    "selector": "boolean",
    "default": false,
    "label": "Telegram me when someone is asking for approval",
    "level": "basic",
    "secret": false,
    "lives_in": "person.notifications",
    "honoured_by": [
      "home"
    ]
  },
  {
    "key": "notifications.backups.target_failing.telegram",
    "scope": "person",
    "selector": "boolean",
    "default": false,
    "label": "Telegram me when backups start failing",
    "level": "basic",
    "secret": false,
    "lives_in": "person.notifications",
    "honoured_by": [
      "home"
    ]
  },
  {
    "key": "notifications.model.download_failed.telegram",
    "scope": "person",
    "selector": "boolean",
    "default": false,
    "label": "Telegram me when a model download fails",
    "level": "basic",
    "secret": false,
    "lives_in": "person.notifications",
    "honoured_by": [
      "home"
    ]
  },
  {
    "key": "notifications.model.download_ready.telegram",
    "scope": "person",
    "selector": "boolean",
    "default": false,
    "label": "Telegram me when a model finishes downloading",
    "level": "basic",
    "secret": false,
    "lives_in": "person.notifications",
    "honoured_by": [
      "home"
    ]
  },
  {
    "key": "notifications.person.band_changed.telegram",
    "scope": "person",
    "selector": "boolean",
    "default": false,
    "label": "Telegram me when a child or teen's profile band updates on a birthday",